{
  "version": "0",
  "meta": {"title": "Handoff seams", "logline": "A Remotion title hands off to HyperFrames, which then hands off badly.", "genre": null, "formats": {"primary": "16:9", "extra": []}, "fps": 30, "durationFrames": 18, "layouts": {"16:9": {"canvas": {"width": 320, "height": 180}, "safe": {"x": 16, "y": 9, "width": 288, "height": 162}, "overlay": null}}},
  "look": {"id": null, "styleBible": null, "axes": {}, "tasteSnapshot": null},
  "audio": {"track": null, "grid": null, "bpm": null, "beatFrames": [], "downbeatFrames": [], "dropFrames": [], "confidence": null},
  "voice": null,
  "shots": [
    {"id": "slide", "startFrame": 0, "endFrame": 6, "engine": "remotion", "entrypoint": "Handoff", "description": "Title slides in and holds on the title shot pose", "entry": "cut", "exit": "handoff", "camera": "custom:locked", "assets": ["font-plex"], "soundCues": [], "stillFrames": [0, 5], "protected": []},
    {"id": "title", "startFrame": 6, "endFrame": 12, "engine": "hyperframes", "entrypoint": "shots/title/index.html", "description": "HYPERFRAMES title, matching handoff in", "entry": "handoff", "exit": "handoff", "camera": "custom:locked", "assets": ["font-plex"], "soundCues": [], "stillFrames": [0, 5], "protected": []},
    {"id": "drift", "startFrame": 12, "endFrame": 18, "engine": "hyperframes", "entrypoint": "shots/drift/index.html", "description": "Intentional mismatch: the declared handoff starts with the title moved up", "entry": "handoff", "exit": "cut", "camera": "custom:locked", "assets": ["font-plex"], "soundCues": [], "stillFrames": [0, 5], "protected": []}
  ],
  "gates": [
    {"id": "G1", "state": "pending", "inputHashes": {}, "decision": null, "notes": [], "rounds": 0},
    {"id": "G2", "state": "pending", "inputHashes": {}, "decision": null, "notes": [], "rounds": 0},
    {"id": "G3", "state": "pending", "inputHashes": {}, "decision": null, "notes": [], "rounds": 0},
    {"id": "G4", "state": "pending", "inputHashes": {}, "decision": null, "notes": [], "rounds": 0},
    {"id": "G5", "state": "pending", "inputHashes": {}, "decision": null, "notes": [], "rounds": 0}
  ],
  "critique": []
}
