{
  "version": "0",
  "meta": {
    "title": "UI kit",
    "logline": "A search field themed from brand tokens types a query and selects a result.",
    "genre": null,
    "formats": {
      "primary": "16:9",
      "extra": []
    },
    "fps": 30,
    "durationFrames": 12,
    "layouts": {
      "16:9": {
        "canvas": {
          "width": 320,
          "height": 180
        },
        "safe": {
          "x": 16,
          "y": 9,
          "width": 288,
          "height": 162
        },
        "overlay": null
      }
    }
  },
  "look": {
    "id": null,
    "styleBible": null,
    "axes": {},
    "tasteSnapshot": null
  },
  "audio": {
    "track": null,
    "grid": null,
    "bpm": null,
    "beatFrames": [],
    "downbeatFrames": [],
    "dropFrames": [],
    "confidence": null
  },
  "voice": null,
  "shots": [
    {
      "id": "kit",
      "startFrame": 0,
      "endFrame": 12,
      "engine": "remotion",
      "entrypoint": "Kit",
      "description": "UI kit behavior clip: the search field types 'clip', then the result row's accent highlight sweeps in",
      "camera": "locked-off",
      "entry": "cut",
      "exit": "cut",
      "assets": [
        "font-plex"
      ],
      "soundCues": [],
      "stillFrames": [
        0,
        11
      ],
      "protected": []
    }
  ],
  "gates": [
    {
      "id": "G1",
      "state": "pending",
      "inputHashes": {},
      "decision": null,
      "notes": [],
      "rounds": 0
    },
    {
      "id": "G2",
      "state": "pending",
      "inputHashes": {},
      "decision": null,
      "notes": [],
      "rounds": 0
    },
    {
      "id": "G3",
      "state": "pending",
      "inputHashes": {},
      "decision": null,
      "notes": [],
      "rounds": 0
    },
    {
      "id": "G4",
      "state": "pending",
      "inputHashes": {},
      "decision": null,
      "notes": [],
      "rounds": 0
    },
    {
      "id": "G5",
      "state": "pending",
      "inputHashes": {},
      "decision": null,
      "notes": [],
      "rounds": 0
    }
  ],
  "critique": []
}
