{
  "version": "0",
  "meta": {"title": "Safe zones", "logline": "One timeline reframed for landscape, portrait and square.", "genre": null, "formats": {"primary": "16:9", "extra": ["9:16", "1:1"]}, "fps": 30, "durationFrames": 12,
    "layouts": {
      "16:9": {"canvas": {"width": 320, "height": 180}, "safe": {"x": 32, "y": 18, "width": 256, "height": 144}, "overlay": null},
      "9:16": {"canvas": {"width": 180, "height": 320}, "safe": {"x": 18, "y": 48, "width": 144, "height": 224}, "overlay": "vertical-social"},
      "1:1": {"canvas": {"width": 240, "height": 240}, "safe": {"x": 24, "y": 24, "width": 192, "height": 192}, "overlay": null}
    }},
  "look": {"id": null, "styleBible": null, "axes": {}, "tasteSnapshot": null},
  "audio": {"track": null, "grid": null, "bpm": null, "beatFrames": [], "downbeatFrames": [], "dropFrames": [], "confidence": null},
  "voice": null,
  "shots": [
    {"id": "remotion", "startFrame": 0, "endFrame": 6, "engine": "remotion", "entrypoint": "Shot", "description": "Wrapped title slides in over full-bleed stripes; SVG mark in the corner of the safe area", "camera": "custom:locked", "entry": "cut", "exit": "cut", "assets": ["font-plex"], "soundCues": [], "stillFrames": [0, 5], "protected": [{"id": "title", "bounds": "measured", "heldFrames": [2, 5]}, {"id": "mark", "bounds": "shots/remotion/mark-bounds.json", "heldFrames": [0, 5]}]},
    {"id": "hyperframes", "startFrame": 6, "endFrame": 12, "engine": "hyperframes", "entrypoint": "shots/hyperframes/index.html", "description": "Wrapped title slides in over full-bleed stripes", "camera": "custom:locked", "entry": "cut", "exit": "cut", "assets": ["font-plex"], "soundCues": [], "stillFrames": [0, 5], "protected": [{"id": "title", "bounds": "measured", "heldFrames": [2, 5]}]}
  ],
  "gates": [
    {"id": "G1", "state": "pending", "inputHashes": {}, "decision": null, "notes": [], "rounds": 0},
    {"id": "G2", "state": "pending", "inputHashes": {}, "decision": null, "notes": [], "rounds": 0},
    {"id": "G3", "state": "pending", "inputHashes": {}, "decision": null, "notes": [], "rounds": 0},
    {"id": "G4", "state": "pending", "inputHashes": {}, "decision": null, "notes": [], "rounds": 0},
    {"id": "G5", "state": "pending", "inputHashes": {}, "decision": null, "notes": [], "rounds": 0}
  ],
  "critique": []
}
