{
  "version": "0",
  "meta": {"title": "Look tests", "logline": "Two moving look tests and one still one, before the board.", "genre": null, "formats": {"primary": "16:9", "extra": ["9:16"]}, "fps": 30, "durationFrames": 0,
    "layouts": {
      "16:9": {"canvas": {"width": 320, "height": 180}, "safe": {"x": 32, "y": 18, "width": 256, "height": 144}, "overlay": null},
      "9:16": {"canvas": {"width": 180, "height": 320}, "safe": {"x": 18, "y": 48, "width": 144, "height": 224}, "overlay": null}
    }},
  "look": {"id": null, "styleBible": null, "axes": {}, "tasteSnapshot": null},
  "audio": {"track": null, "grid": null, "bpm": null, "beatFrames": [], "downbeatFrames": [], "dropFrames": [], "confidence": null},
  "voice": null,
  "shots": [],
  "gates": [
    {"id": "G1", "state": "pending", "inputHashes": {}, "decision": null, "notes": [], "rounds": 0},
    {"id": "G2", "state": "pending", "inputHashes": {}, "decision": null, "notes": [], "rounds": 0},
    {"id": "G3", "state": "pending", "inputHashes": {}, "decision": null, "notes": [], "rounds": 0},
    {"id": "G4", "state": "pending", "inputHashes": {}, "decision": null, "notes": [], "rounds": 0},
    {"id": "G5", "state": "pending", "inputHashes": {}, "decision": null, "notes": [], "rounds": 0}
  ],
  "critique": []
}
